<?xml version="1.0" encoding="UTF-8"?>
<!-- edited with XMLSpy v2008 rel. 2 (http://www.altova.com) by mazuki (darksiderg) -->
<xs:schema xmlns:xs="http://www.w3.org/2001/XMLSchema" elementFormDefault="qualified" attributeFormDefault="unqualified">
	<xs:element name="peliculas">
		<xs:annotation>
			<xs:documentation>Comment describing your root element</xs:documentation>
		</xs:annotation>
		<xs:complexType>
			<xs:sequence>
				<xs:element name="pelicula" maxOccurs="unbounded">
					<xs:complexType>
						<xs:sequence>
							<xs:element name="nombre">
								<xs:simpleType>
									<xs:restriction base="xs:string">
										<xs:minLength value="1"/>
										<xs:maxLength value="255"/>
									</xs:restriction>
								</xs:simpleType>
							</xs:element>
							<xs:element name="portada">
								<xs:simpleType>
									<xs:restriction base="xs:string">
										<xs:minLength value="1"/>
										<xs:maxLength value="255"/>
									</xs:restriction>
								</xs:simpleType>
							</xs:element>
							<xs:element name="trailer" minOccurs="0">
								<xs:simpleType>
									<xs:restriction base="xs:string">
										<xs:minLength value="1"/>
										<xs:maxLength value="255"/>
									</xs:restriction>
								</xs:simpleType>
							</xs:element>
							<xs:element name="valoracion">
								<xs:simpleType>
									<xs:restriction base="xs:int">
										<xs:minInclusive value="1"/>
										<xs:maxInclusive value="5"/>
									</xs:restriction>
								</xs:simpleType>
							</xs:element>
							<xs:element name="voto">
								<xs:simpleType>
									<xs:restriction base="xs:int">
										<xs:minInclusive value="1"/>
										<xs:maxInclusive value="1000000"/>
									</xs:restriction>
								</xs:simpleType>
							</xs:element>
							<xs:element name="clasificacion">
								<xs:simpleType>
									<xs:restriction base="xs:string">
										<xs:minLength value="1"/>
										<xs:maxLength value="255"/>
									</xs:restriction>
								</xs:simpleType>
							</xs:element>
							<xs:element name="duracion">
								<xs:simpleType>
									<xs:restriction base="xs:int">
										<xs:minInclusive value="1"/>
										<xs:maxInclusive value="500"/>
									</xs:restriction>
								</xs:simpleType>
							</xs:element>
							<xs:element name="paises">
								<xs:complexType>
									<xs:sequence>
										<xs:element name="pais" maxOccurs="unbounded">
											<xs:simpleType>
												<xs:restriction base="xs:string">
													<xs:minLength value="1"/>
													<xs:maxLength value="255"/>
												</xs:restriction>
											</xs:simpleType>
										</xs:element>
									</xs:sequence>
								</xs:complexType>
							</xs:element>
							<xs:element name="generos">
								<xs:complexType>
									<xs:sequence>
										<xs:element name="genero" maxOccurs="unbounded">
											<xs:simpleType>
												<xs:restriction base="xs:string">
													<xs:minLength value="1"/>
													<xs:maxLength value="255"/>
												</xs:restriction>
											</xs:simpleType>
										</xs:element>
									</xs:sequence>
								</xs:complexType>
							</xs:element>
							<xs:element name="estreno">
								<xs:complexType>
									<xs:attribute name="fecha" use="required">
										<xs:simpleType>
											<xs:restriction base="xs:date">
												<xs:minInclusive value="2010-01-01"/>
											</xs:restriction>
										</xs:simpleType>
									</xs:attribute>
								</xs:complexType>
							</xs:element>
							<xs:element name="directores">
								<xs:complexType>
									<xs:sequence>
										<xs:element name="director" maxOccurs="unbounded">
											<xs:simpleType>
												<xs:restriction base="xs:string">
													<xs:minLength value="1"/>
													<xs:maxLength value="255"/>
												</xs:restriction>
											</xs:simpleType>
										</xs:element>
									</xs:sequence>
								</xs:complexType>
							</xs:element>
							<xs:element name="guionistas">
								<xs:complexType>
									<xs:sequence>
										<xs:element name="guionista" maxOccurs="unbounded">
											<xs:simpleType>
												<xs:restriction base="xs:string">
													<xs:minLength value="1"/>
													<xs:maxLength value="255"/>
												</xs:restriction>
											</xs:simpleType>
										</xs:element>
									</xs:sequence>
								</xs:complexType>
							</xs:element>
							<xs:element name="productores">
								<xs:complexType>
									<xs:sequence>
										<xs:element name="productor" maxOccurs="unbounded">
											<xs:simpleType>
												<xs:restriction base="xs:string">
													<xs:minLength value="1"/>
													<xs:maxLength value="255"/>
												</xs:restriction>
											</xs:simpleType>
										</xs:element>
									</xs:sequence>
								</xs:complexType>
							</xs:element>
							<xs:element name="actores">
								<xs:complexType>
									<xs:sequence>
										<xs:element name="actor" maxOccurs="unbounded">
											<xs:simpleType>
												<xs:restriction base="xs:string">
													<xs:minLength value="1"/>
													<xs:maxLength value="255"/>
												</xs:restriction>
											</xs:simpleType>
										</xs:element>
									</xs:sequence>
								</xs:complexType>
							</xs:element>
							<xs:element name="sinopsis">
								<xs:complexType>
									<xs:sequence>
										<xs:element name="parrafo" maxOccurs="unbounded">
											<xs:simpleType>
												<xs:restriction base="xs:string">
													<xs:minLength value="1"/>
													<xs:maxLength value="255"/>
												</xs:restriction>
											</xs:simpleType>
										</xs:element>
									</xs:sequence>
								</xs:complexType>
							</xs:element>
						</xs:sequence>
					</xs:complexType>
				</xs:element>
			</xs:sequence>
		</xs:complexType>
	</xs:element>
</xs:schema>
